{
  "$schema": "https://schema.rtemis.org/a3/v1/schema.json",
  "a3_version": "1.0.0",
  "sequence": "MAEPRQEFEVMEDHAGTYGLGDRKDQGGYTMHQDQEGDTDAGLKESPLQTPTEDGSEEPGSETSDAKSTPTAEDVTAPLVDEGAPGKQAAAQPHTEIPEGTTAEEAGIGDTPSLEDEAAGHVTQARMVSKSKDGTGSDDKKAKGADGKTKIATPRGAAPPGQKGQANATRIPAKTPPAPKTPPSSGEPPKSGDRSGYSSPGSPGTPGSRSRTPSLPTPPTREPKKVAVVRTPPKSPSSAKSRLQTAPVPMPDLKNVKSKIGSTENLKHQPGGGKVQIINKKLDLSNVQSKCGSKDNIKHVPGGGSVQIVYKPVDLSKVTSKCGSLGNIHHKPGGGQVEVKSEKLDFKDRVQSKIGSLDNITHVPGGGNKKIETHKLTFRENAKAKTDHGAEIVYKSPVVSGDTSPRHLSNVSSTGSIDMVDSPQLATLADEVSASLAKQGL",
  "annotations": {
    "site": {
      "Disease_associated_variant": {
        "index": [
          4, 5, 14, 17, 18, 30, 39, 41, 55, 75, 86, 90, 152, 176, 178, 200, 203,
          211, 224, 227, 239, 255, 257, 260, 266, 272, 273, 279, 280, 284, 285,
          287, 291, 296, 300, 301, 303, 305, 320, 332, 335, 336, 337, 342, 352,
          356, 360, 363, 364, 366, 369, 372, 389, 406, 410, 427, 441
        ],
        "type": ""
      },
      "N-terminal Repeat": {
        "index": [
          45, 46, 47, 48, 49, 50, 51, 52, 53, 54, 55, 56, 57, 58, 59, 60, 61, 62,
          63, 64, 65, 66, 67, 68, 69, 70, 71, 72, 73, 74, 75, 76, 77, 78, 79, 80,
          81, 82, 83, 84, 85, 86
        ],
        "type": ""
      },
      "Microtubule Binding Domain (R1, R3, R4)": {
        "index": [
          244, 245, 246, 247, 248, 249, 250, 251, 252, 253, 254, 255, 256, 257,
          258, 259, 260, 261, 262, 263, 264, 265, 266, 267, 268, 269, 270, 271,
          272, 273, 274, 306, 307, 308, 309, 310, 311, 312, 313, 314, 315, 316,
          317, 318, 319, 320, 321, 322, 323, 324, 325, 326, 327, 328, 329, 330,
          331, 332, 333, 334, 335, 336, 337, 338, 339, 340, 341, 342, 343, 344,
          345, 346, 347, 348, 349, 350, 351, 352, 353, 354, 355, 356, 357, 358,
          359, 360, 361, 362, 363, 364, 365, 366, 367, 368
        ],
        "type": ""
      },
      "Microtubule Binding Domain (R2)": {
        "index": [
          274, 275, 276, 277, 278, 279, 280, 281, 282, 283, 284, 285, 286, 287,
          288, 289, 290, 291, 292, 293, 294, 295, 296, 297, 298, 299, 300, 301,
          302, 303, 304, 305
        ],
        "type": ""
      }
    },
    "region": {
      "KXGS": {
        "index": [[259, 262], [290, 293], [321, 324], [353, 356]],
        "type": ""
      },
      "Canonical KFERQ": {
        "index": [[336, 340], [347, 351]],
        "type": ""
      },
      "Potential KFERQ": {
        "index": [[240, 244], [280, 284], [307, 311], [343, 347]],
        "type": ""
      },
      "Phosphodegron": {
        "index": [[46, 51], [149, 154], [195, 200], [208, 213], [231, 236], [400, 405]],
        "type": ""
      }
    },
    "ptm": {
      "Phosphorylation": {
        "index": [
          17, 18, 29, 30, 39, 46, 50, 52, 56, 61, 63, 64, 68, 69, 71, 76, 95, 101,
          102, 111, 113, 123, 129, 131, 135, 137, 149, 153, 169, 175, 181, 184,
          185, 191, 195, 197, 198, 199, 202, 205, 208, 210, 217, 212, 214, 220,
          229, 235, 231, 232, 235, 236, 237, 238, 241, 245, 258, 262, 263, 285,
          289, 293, 305, 316, 319, 320, 321, 324, 336, 341, 352, 356, 361, 362,
          366, 370, 373, 380, 382, 383, 385, 386, 394, 396, 403, 409, 400, 404,
          412, 413, 414, 416, 435, 427, 433, 422
        ],
        "type": ""
      },
      "Acetylation": {
        "index": [
          148, 150, 163, 174, 180, 224, 225, 234, 240, 254, 257, 259, 267, 274,
          280, 281, 290, 294, 298, 311, 317, 321, 331, 343, 347, 353, 369, 370,
          375, 383, 385, 395
        ],
        "type": ""
      },
      "Methylation": {
        "index": [
          24, 44, 67, 87, 126, 148, 150, 155, 163, 174, 180, 190, 234, 240, 254,
          259, 267, 281, 290, 311, 317, 331, 349, 353, 369, 370, 375, 385, 395
        ],
        "type": ""
      },
      "Glycation": {
        "index": [
          67, 87, 132, 148, 150, 163, 174, 180, 190, 225, 234, 259, 267, 274, 280,
          281, 290, 298, 311, 321, 331, 340, 343, 347, 353, 369, 370, 375, 383,
          385, 395
        ],
        "type": ""
      },
      "Ubiquitination": {
        "index": [
          44, 254, 259, 267, 281, 290, 298, 311, 317, 321, 331, 343, 347, 353,
          369, 375, 385
        ],
        "type": ""
      },
      "O-Glycosilation": {
        "index": [123, 208, 238, 400, 412, 413],
        "type": ""
      },
      "SUMOylation": {
        "index": [340],
        "type": ""
      }
    },
    "processing": {},
    "variant": []
  },
  "metadata": {
    "uniprot_id": "P10636",
    "description": "Tau Post-translational Modifications: Dynamic Transformers of Tau Function, Degradation, and Aggregation",
    "reference": "https://www.frontiersin.org/journals/neurology/articles/10.3389/fneur.2020.595532",
    "organism": ""
  }
}
